video_id,comment_id,author,author_channel_url,author_channel_id,comment,published_at,updated_at,like_count,viewer_rating,can_rate,is_reply,parent_id,author_profile_image_url,channel_id,inter-arrival-time,inter-arrival-time-seconds
MFrSq1it0Es,Ugw_LwM-GZ8hq3DeQuZ4AaABAg,@anavieira4653,http://www.youtube.com/@anavieira4653,UC7NDFjmDjSjO3qnzWKBRSJg,Ecerio,2024-03-13 16:48:56+00:00,2024-03-13T16:48:56Z,0,none,True,False,,,UCIPA6iWNaoetaa1T46RkzXw,0 days 03:21:11,12071.0
MFrSq1it0Es,UgyoYFlhPtpBzF4OuAx4AaABAg,@anavieira4653,http://www.youtube.com/@anavieira4653,UC7NDFjmDjSjO3qnzWKBRSJg,Ecerio,2024-03-13 16:49:49+00:00,2024-03-13T16:49:49Z,0,none,True,False,,,UCIPA6iWNaoetaa1T46RkzXw,0 days 00:00:53,53.0
MFrSq1it0Es,UgyILMjlJIVifvh_o514AaABAg,@Ilovestar126,http://www.youtube.com/@Ilovestar126,UCzLnIRs5X0FSpZLSDsP790A,"Authentic,vc fez a minha infância toda,amo mt o seu canal,eu cantava todas as músicas do canal KKKKKK, obrigada authentic, obrigada msm ❤",2024-03-14 02:27:59+00:00,2024-03-14T02:27:59Z,12,none,True,False,,,UCIPA6iWNaoetaa1T46RkzXw,0 days 09:38:10,34690.0
MFrSq1it0Es,UgwEeukgA08qiJucq6d4AaABAg,@LukasGMendes,http://www.youtube.com/@LukasGMendes,UCsGuNzx1Q3UHfvkieQbiUug,"Eae Authentic valeu pelas dicas, em 2022 consegui ler sua trilogia completa",2024-03-14 12:14:23+00:00,2024-03-14T12:14:23Z,1,none,True,False,,,UCIPA6iWNaoetaa1T46RkzXw,0 days 09:46:24,35184.0
MFrSq1it0Es,UgygSowTmq7gLJb6cJl4AaABAg,@SenhorArtuux,http://www.youtube.com/@SenhorArtuux,UC7AYCGOiBco4cpopS0Fut_A,Só a voz dele dá nostalgia                                        edit:vc fez parte da minha infância botei sua música no meu aniversário de 8 anos kk muito anos atrás.,2024-03-14 13:19:16+00:00,2024-03-14T22:53:26Z,0,none,True,False,,,UCIPA6iWNaoetaa1T46RkzXw,0 days 01:04:53,3893.0
MFrSq1it0Es,UgwEeukgA08qiJucq6d4AaABAg.A0y8Q_iwFDJA0zH79iQSFq,@AuthenticGames,http://www.youtube.com/@AuthenticGames,UCIPA6iWNaoetaa1T46RkzXw,Fico feliz em saber 😊,2024-03-14 22:49:37+00:00,2024-03-14T22:49:37Z,1,none,True,True,UgwEeukgA08qiJucq6d4AaABAg,https://yt3.ggpht.com/OTToktW_fdew6vLD8KAGOKmcFmvwi9pnlzUo9sQcJmY43LxbBYoH5gRsz5FNhOf2ImNn9vLNWtE=s48-c-k-c0x00ffffff-no-rj,UCIPA6iWNaoetaa1T46RkzXw,0 days 09:30:21,34221.0
MFrSq1it0Es,UgybItU49wM0i5N54Jd4AaABAg,@Cenoura_Bs,http://www.youtube.com/@Cenoura_Bs,UCbaJPbiNsoUEoav-MIr7FCA,Authentic vou a fazer mais vídeos por favor,2024-03-15 01:18:35+00:00,2024-03-15T01:18:35Z,0,none,True,False,,,UCIPA6iWNaoetaa1T46RkzXw,0 days 02:28:58,8938.0
MFrSq1it0Es,Ugxk0YaufgOa0yLKlOJ4AaABAg,@thomasfurlaneto8593,http://www.youtube.com/@thomasfurlaneto8593,UC0uvr8yhkSKpNEalOp4HMjQ,Volta com seus vídeos antigos era muito bom,2024-03-16 00:01:35+00:00,2024-03-16T00:01:35Z,0,none,True,False,,,UCIPA6iWNaoetaa1T46RkzXw,0 days 22:43:00,81780.0
MFrSq1it0Es,UgznAjLGEJNf9BceIU14AaABAg,@Ben10minegamer8,http://www.youtube.com/@Ben10minegamer8,UCxAD8d1f4lv15hxFr-ejzPQ,Authentic games legal tem uma skin fofa canal faz parte da minha infância parabéns authentic games❤,2024-03-16 02:04:19+00:00,2024-03-16T02:04:19Z,2,none,True,False,,,UCIPA6iWNaoetaa1T46RkzXw,0 days 02:02:44,7364.0
MFrSq1it0Es,UgzGwIhbQNa6vIK--o54AaABAg,@matheuscarvalho3436,http://www.youtube.com/@matheuscarvalho3436,UC3DJNKu-FVeiKStFmLVP8sg,"Slk saudade de ver seus vídeos, depois de muito tempo o YouTube me recomendou, slk nostalgia pura",2024-03-16 11:04:56+00:00,2024-03-16T11:04:56Z,0,none,True,False,,,UCIPA6iWNaoetaa1T46RkzXw,0 days 09:00:37,32437.0
MFrSq1it0Es,UgwlvwcoihqnmjQbLg54AaABAg,@Minhas_pink_venos,http://www.youtube.com/@Minhas_pink_venos,UCHDACxP1yLmWIsLcn-RcStA,Cd o himariu ele sumiu do nd da família craft,2024-03-17 00:11:16+00:00,2024-03-17T00:11:16Z,0,none,True,False,,,UCIPA6iWNaoetaa1T46RkzXw,0 days 13:06:20,47180.0
MFrSq1it0Es,UgyYL4-fLyjdlJaYla54AaABAg,@LFPD_2011,http://www.youtube.com/@LFPD_2011,UCyZ5HEMfMO1rmm44A72C5EA,Jovems Milionário e os Mlk empresários.,2024-03-20 00:59:31+00:00,2024-03-20T00:59:31Z,0,none,True,False,,,UCIPA6iWNaoetaa1T46RkzXw,3 days 00:48:15,262095.0
MFrSq1it0Es,Ugw6_OG7wk5-1aV_0zp4AaABAg,@JoseRubensvieira-jz8nj,http://www.youtube.com/@JoseRubensvieira-jz8nj,UCsmLeyZ5KhwLj-5_0onbBig,"Authentique lembra da quele post com a familia craft ""inteira"" cade o jazz?",2024-03-20 13:38:09+00:00,2024-03-20T13:38:09Z,0,none,True,False,,,UCIPA6iWNaoetaa1T46RkzXw,0 days 12:38:38,45518.0
MFrSq1it0Es,Ugwv3ZUFg24N98TCUbd4AaABAg,@marcusmarangon,http://www.youtube.com/@marcusmarangon,UCEpeETC234pkeEzsOf5c4AQ,glr do time do prokin br clica no like,2024-03-20 17:17:43+00:00,2024-03-20T17:17:43Z,0,none,True,False,,,UCIPA6iWNaoetaa1T46RkzXw,0 days 03:39:34,13174.0
MFrSq1it0Es,UgxE-G-tZpgrpJ0WE5B4AaABAg,@H0miesCraft,http://www.youtube.com/@H0miesCraft,UC4X0n4bjNeuaF6MaKDOllcA,"Authentic, não sei se vc vai ler isso mas acompanhamos seu canal des de 2012, muuuuuito tempo né?, sempre sonhamos em um gravar vídeos com vc, tenho até seu livro, obs: não peguei autógrafo infelizmente, neste canal estamos tentando recriar a era de ouro do youtube, tentando paecerias com outros youtubers recentes e antigos, mas não conseguimos nada até agora por sermos pequenos ainda..., flw e deus te abençoe Authentic",2024-03-20 23:17:55+00:00,2024-03-20T23:17:55Z,0,none,True,False,,,UCIPA6iWNaoetaa1T46RkzXw,0 days 06:00:12,21612.0
MFrSq1it0Es,UgzjSWU1JImLQSogID14AaABAg,@Pdr-fu1in,http://www.youtube.com/@Pdr-fu1in,UC1V_LslWzk9c3i6HZLjJpRA,Vídeo tt,2024-03-21 15:20:55+00:00,2024-03-21T15:20:55Z,0,none,True,False,,,UCIPA6iWNaoetaa1T46RkzXw,0 days 16:03:00,57780.0
MFrSq1it0Es,Ugxdv5HLCEcdv9BmATt4AaABAg,@Estok2050,http://www.youtube.com/@Estok2050,UCW6Sk_EWAhZgzBEvONjP4kg,Mano seu seu fã vc fez parte da minha infância  que bom que vc continue gravando de novo🎉❤,2024-03-21 23:45:45+00:00,2024-03-21T23:45:45Z,0,none,True,False,,,UCIPA6iWNaoetaa1T46RkzXw,0 days 08:24:50,30290.0
MFrSq1it0Es,UgyoNK1tuZlvub7usLZ4AaABAg,@playerjinho_444,http://www.youtube.com/@playerjinho_444,UCOkw23PdyjqN6v3uyjjRFCw,"Obrigado authenticgames por marcar minha infância com as suas séries de survival, eu lembro há um tempão eu chegando da escola e assistindo a sua série com o Spok e jazz 😢",2024-03-22 20:55:10+00:00,2024-03-22T20:55:10Z,0,none,True,False,,,UCIPA6iWNaoetaa1T46RkzXw,0 days 21:09:25,76165.0
MFrSq1it0Es,Ugx8QaMeFYe8uXElmRR4AaABAg,@everton4226,http://www.youtube.com/@everton4226,UCZcdWvH3pYXt7jWpggB5DSw,autenticação eu tenho um livro de português na página 92 tem falando você lá  falando dos seus vídeos😊,2024-03-22 21:03:27+00:00,2024-03-22T21:03:27Z,0,none,True,False,,,UCIPA6iWNaoetaa1T46RkzXw,0 days 00:08:17,497.0
MFrSq1it0Es,Ugz8Tl3MfekrXz5SUc14AaABAg,@danielweis_xp,http://www.youtube.com/@danielweis_xp,UCDxU-zIIn9j8rvGVtJWjE6w,Eu tenho seu boneco sou seu fã,2024-03-23 11:21:10+00:00,2024-03-23T11:21:10Z,0,none,True,False,,,UCIPA6iWNaoetaa1T46RkzXw,0 days 14:17:43,51463.0
MFrSq1it0Es,UgxQr-RSEvitp4b5R2N4AaABAg,@fernandamaria376,http://www.youtube.com/@fernandamaria376,UC6YzOxHV5_Qk9KA_Ggh4dUA,Autentic vc voltolllll finalmente!!!!!!!!!!!!!,2024-03-23 11:57:19+00:00,2024-03-23T11:57:19Z,0,none,True,False,,,UCIPA6iWNaoetaa1T46RkzXw,0 days 00:36:09,2169.0
MFrSq1it0Es,UgxWrulnJkBHqhCkV7l4AaABAg,@GABI_GAME_TUDO,http://www.youtube.com/@GABI_GAME_TUDO,UCWpDePtfgFB2CD2VBGirAFQ,ja li varios livros seus,2024-03-23 15:16:28+00:00,2024-03-23T15:16:28Z,2,none,True,False,,,UCIPA6iWNaoetaa1T46RkzXw,0 days 03:19:09,11949.0
MFrSq1it0Es,UgzAlrQu8_Y1Ofp0BRZ4AaABAg,@GABI_GAME_TUDO,http://www.youtube.com/@GABI_GAME_TUDO,UCWpDePtfgFB2CD2VBGirAFQ,ja li varios videos seus,2024-03-23 15:16:58+00:00,2024-03-23T15:16:58Z,0,none,True,False,,,UCIPA6iWNaoetaa1T46RkzXw,0 days 00:00:30,30.0
MFrSq1it0Es,Ugx0BeQLGmV5HYob2L14AaABAg,@darktv815,http://www.youtube.com/@darktv815,UCrHJ2RKvZIuokECH8FEAtkA,Tô chorando muito o Authentique fez minha infância mais a voz dele tá mudando muito e só de lembrar dos vídeos antigos dele eu choro 😢😢😢,2024-03-23 19:07:25+00:00,2024-03-23T19:07:25Z,0,none,True,False,,,UCIPA6iWNaoetaa1T46RkzXw,0 days 03:50:27,13827.0
MFrSq1it0Es,Ugx1VkdP3fN9OpEea2R4AaABAg,@andreportuga7571,http://www.youtube.com/@andreportuga7571,UCJ7MkCO1cnmSLIyzNdbf0tA,Gente então eu fico muito feliz quando o autêntic faz vídeos de minecraft mais eu estou com muita saudade de ver o enaldinho e ele juntos só os mais antigos sabem por favor autentic fala com o enaldinho 😢😢,2024-03-23 23:22:09+00:00,2024-03-23T23:22:09Z,0,none,True,False,,,UCIPA6iWNaoetaa1T46RkzXw,0 days 04:14:44,15284.0
MFrSq1it0Es,UgzFcpd84LeiWPIXYx54AaABAg,@miguelplays8623,http://www.youtube.com/@miguelplays8623,UCdjXpqFjp5z5d8jRr9S8UsQ,Authentic cara voce fez a era de ouro do ytb  😢 voce me marcou e ainda assisto sdus videos antigos...,2024-03-24 11:15:17+00:00,2024-03-24T11:15:17Z,0,none,True,False,,,UCIPA6iWNaoetaa1T46RkzXw,0 days 11:53:08,42788.0
MFrSq1it0Es,UgyT7zJcWXRj34moRJl4AaABAg,@matheusvaliattigiacomin757,http://www.youtube.com/@matheusvaliattigiacomin757,UCst4c7SH53zjrGqjl7Zu8Tg,Authentic O que aconteceu com seu cachorro Sheik?,2024-03-24 23:31:17+00:00,2024-03-24T23:31:17Z,0,none,True,False,,,UCIPA6iWNaoetaa1T46RkzXw,0 days 12:16:00,44160.0
MFrSq1it0Es,UgzqZ9DhOgwnqNs6-194AaABAg,@MusicasFestas-i1n,http://www.youtube.com/@MusicasFestas-i1n,UC_qieYFiAg6jcU1q1Vc7IHw,AuthenticGames eu comprei seu ovo de páscoa,2024-03-25 20:07:33+00:00,2024-03-25T20:07:33Z,0,none,True,False,,,UCIPA6iWNaoetaa1T46RkzXw,0 days 20:36:16,74176.0
MFrSq1it0Es,UgwrQZTIO_n2mm0vKih4AaABAg,@jundiacalestenia,http://www.youtube.com/@jundiacalestenia,UCAdxYN2qAylogr9wzs8xwEQ,"Essa lenda retornou...minha infância inteira eu assisti aos vídeos de polícia e ladrão,esconde-esconde,aventura com mods...
Obrigado por cada momento authentic.❤",2024-03-30 14:45:12+00:00,2024-03-30T14:45:12Z,0,none,True,False,,,UCIPA6iWNaoetaa1T46RkzXw,4 days 18:37:39,412659.0
MFrSq1it0Es,UgyFH0GRz6CQjT0IOP94AaABAg,@ave_verde,http://www.youtube.com/@ave_verde,UCX1ym1cR4B4RkhDpQiRrCWg,Só não pode amanhecer antes  de fazer isso né kkkk,2024-03-31 03:53:00+00:00,2024-03-31T03:53:00Z,0,none,True,False,,,UCIPA6iWNaoetaa1T46RkzXw,0 days 13:07:48,47268.0
MFrSq1it0Es,Ugw2DsueAPFVzeaA-Ot4AaABAg,@larissarosa6626,http://www.youtube.com/@larissarosa6626,UCmwrmhC7zLl35hb6Tj1keHQ,Eu tenho o seu doneco 😊,2024-03-31 12:02:27+00:00,2024-03-31T12:02:27Z,0,none,True,False,,,UCIPA6iWNaoetaa1T46RkzXw,0 days 08:09:27,29367.0
MFrSq1it0Es,Ugz9MgProbk9GuxOOKN4AaABAg,@pliciamrodrigues5959,http://www.youtube.com/@pliciamrodrigues5959,UCbqp8ZDj5BoHaReCprvXLQQ,"Oi seus videos são muito desde antigamente o minecraft foi antigo😊😊😊😊😊😊😊😊😊😊😊😊😊😊😊
😊😊😊😊😊😊😊😊",2024-03-31 14:59:52+00:00,2024-03-31T14:59:52Z,0,none,True,False,,,UCIPA6iWNaoetaa1T46RkzXw,0 days 02:57:25,10645.0
MFrSq1it0Es,Ugzxw5th6_RV-E0onm94AaABAg,@Eliericka,http://www.youtube.com/@Eliericka,UCP2_Hmkaqh7m1aT1yk0TqJQ,Eu tenho o seu boneco,2024-04-01 01:10:52+00:00,2024-04-01T01:10:52Z,0,none,True,False,,,UCIPA6iWNaoetaa1T46RkzXw,0 days 10:11:00,36660.0
MFrSq1it0Es,Ugxnlb_Cv77TkgDCLTB4AaABAg,@migu1749,http://www.youtube.com/@migu1749,UC4hPoZmq1b4WYbxwA2tD3DA,Caraca mo boa essa dica,2024-04-01 16:01:26+00:00,2024-04-01T16:01:26Z,0,none,True,False,,,UCIPA6iWNaoetaa1T46RkzXw,0 days 14:50:34,53434.0
MFrSq1it0Es,UgxAGuxVdjpycx1X1hp4AaABAg,@Broken-s7x3w,http://www.youtube.com/@Broken-s7x3w,UCAeq3SzHt7Ch0bA15HpWGAw,Eu ganhei um ovo de Páscoa com o seu boneco 😊 da arcor,2024-04-01 19:06:21+00:00,2024-04-01T19:06:21Z,0,none,True,False,,,UCIPA6iWNaoetaa1T46RkzXw,0 days 03:04:55,11095.0
MFrSq1it0Es,UgzUWUakI0I3yhe-_Nt4AaABAg,@DaniloOliveira-t1q,http://www.youtube.com/@DaniloOliveira-t1q,UCONNk017zkRI6j41G0T0czg,Toque gamer,2024-04-02 06:23:18+00:00,2024-04-02T06:23:18Z,0,none,True,False,,,UCIPA6iWNaoetaa1T46RkzXw,0 days 11:16:57,40617.0
MFrSq1it0Es,UgwfG8jMtPLvPQqDmCR4AaABAg,@DaniloOliveira-t1q,http://www.youtube.com/@DaniloOliveira-t1q,UCONNk017zkRI6j41G0T0czg,Notic gamers eu tenho o seu mini boneco do Minecraft,2024-04-02 06:23:32+00:00,2024-04-02T06:23:32Z,0,none,True,False,,,UCIPA6iWNaoetaa1T46RkzXw,0 days 00:00:14,14.0
MFrSq1it0Es,UgwmfhtjnErg6Sujra94AaABAg,@DaniloOliveira-t1q,http://www.youtube.com/@DaniloOliveira-t1q,UCONNk017zkRI6j41G0T0czg,Eu só vou te dar esse mini boneco seu do Minecraft se você chegar a 2 milhões,2024-04-02 06:23:43+00:00,2024-04-02T06:23:43Z,0,none,True,False,,,UCIPA6iWNaoetaa1T46RkzXw,0 days 00:00:11,11.0
MFrSq1it0Es,UgwEeukgA08qiJucq6d4AaABAg.A0y8Q_iwFDJA1pvcyyYUf8,@Sr_nino,http://www.youtube.com/@Sr_nino,UCTQBGtM-sMGrYJ-1QomvuxQ,​@@AuthenticGameste asisto desde 2019 saudade daquela epoca eu nunca vou parar,2024-04-05 04:11:21+00:00,2024-04-05T04:11:21Z,0,none,True,True,UgwEeukgA08qiJucq6d4AaABAg,https://yt3.ggpht.com/8lOKnwrONSaKojTNFExBLqtkDRD2h1Af3CIKQvgQCbf3l3Ck7_O4YLmBilYBGi5RS2x73ZXnNMU=s48-c-k-c0x00ffffff-no-rj,UCIPA6iWNaoetaa1T46RkzXw,2 days 21:47:38,251258.0
MFrSq1it0Es,UgxiFGlEQpyPX9hhLKd4AaABAg,@EdysalesGoogle,http://www.youtube.com/@EdysalesGoogle,UCeizdorEgBZhaYLtbnqOcZA,AuthenticGames  eu ti assistio  vc 2011 mn so seu fã mn parabéns pelo seu canal vc foi único e YouTube que fez minha infância,2024-04-05 15:02:20+00:00,2024-04-05T15:02:20Z,0,none,True,False,,,UCIPA6iWNaoetaa1T46RkzXw,0 days 10:50:59,39059.0
MFrSq1it0Es,UgxiFGlEQpyPX9hhLKd4AaABAg.A1r57vAszbNA1rMHxkZWzf,@reginadejesus5976,http://www.youtube.com/@reginadejesus5976,UCvu6_zmDB_Downovi9CUniQ,"Deixa de ser mentiroso, 2011 cê nem tinha nascido sendo que você tem 13 muleke",2024-04-05 17:32:16+00:00,2024-04-05T17:32:16Z,0,none,True,True,UgxiFGlEQpyPX9hhLKd4AaABAg,https://yt3.ggpht.com/ytc/AIdro_nxiCSacWB10frsj3wllan0jadK6eWyr2Vn6IEGLSw=s48-c-k-c0x00ffffff-no-rj,UCIPA6iWNaoetaa1T46RkzXw,0 days 02:29:56,8996.0
MFrSq1it0Es,UgwU90eO1l5a5i8qbsV4AaABAg,@Lairbagon,http://www.youtube.com/@Lairbagon,UCU_KP0mpAzy_fL_7Z-e51fA,Opa tt br fazer uma collab,2024-04-05 23:26:12+00:00,2024-04-05T23:26:12Z,1,none,True,False,,,UCIPA6iWNaoetaa1T46RkzXw,0 days 05:53:56,21236.0
MFrSq1it0Es,UgxiFGlEQpyPX9hhLKd4AaABAg.A1r57vAszbNA1sL5EtjWvH,@EdysalesGoogle,http://www.youtube.com/@EdysalesGoogle,UCeizdorEgBZhaYLtbnqOcZA,@@reginadejesus5976 vai s fd meu amigo eu tinha 3 anos e assistia todos vídeos deles mn 🖕🖕🖕 vai s fd por favor,2024-04-06 02:41:02+00:00,2024-04-18T00:54:00Z,0,none,True,True,UgxiFGlEQpyPX9hhLKd4AaABAg,https://yt3.ggpht.com/ElEyWlNggazLJsrJbJXOIP6XOEdGe6PC4N5w0HcaPRpjj3UhmxanwHH3igHmCzZG91R1Yncx5CQ=s48-c-k-c0x00ffffff-no-rj,UCIPA6iWNaoetaa1T46RkzXw,0 days 03:14:50,11690.0
MFrSq1it0Es,Ugyy76G2r1dhJ1tMpXx4AaABAg,@JOSÉFELIPESL,http://www.youtube.com/@JOS%C3%89FELIPESL,UCrDc-UA25hZMU6Y4rNft0Jw,Romano romano cade😢😢😢😢😢,2024-04-06 23:48:03+00:00,2024-04-06T23:48:03Z,0,none,True,False,,,UCIPA6iWNaoetaa1T46RkzXw,0 days 21:07:01,76021.0
MFrSq1it0Es,UgyOWlvb-nMCDBJB--h4AaABAg,@AldoLuizMello,http://www.youtube.com/@AldoLuizMello,UCihe3e2O7XJjZNQ1CpQI-tQ,Eu tenho o seu eu tenho um boneco = seu por favor curtiu o meu comentário❤❤❤❤,2024-04-18 19:46:00+00:00,2024-04-18T19:46:00Z,0,none,True,False,,,UCIPA6iWNaoetaa1T46RkzXw,11 days 19:57:57,1022277.0
MFrSq1it0Es,UgxiFGlEQpyPX9hhLKd4AaABAg.A1r57vAszbNA2YoE7aBtSk,@EdysalesGoogle,http://www.youtube.com/@EdysalesGoogle,UCeizdorEgBZhaYLtbnqOcZA,@@reginadejesus5976  vai s fd seu fd vc  3 ano ainda e seu ruim reprovado vc e um fd   eu assisti s seu fd ne sabe que dia e nascindo  seu mlk pobre,2024-04-22 23:51:44+00:00,2024-04-22T23:51:44Z,0,none,True,True,UgxiFGlEQpyPX9hhLKd4AaABAg,https://yt3.ggpht.com/ElEyWlNggazLJsrJbJXOIP6XOEdGe6PC4N5w0HcaPRpjj3UhmxanwHH3igHmCzZG91R1Yncx5CQ=s48-c-k-c0x00ffffff-no-rj,UCIPA6iWNaoetaa1T46RkzXw,4 days 04:05:44,360344.0
MFrSq1it0Es,Ugzlj4uC5orHG5aLtpB4AaABAg,@galinha667,http://www.youtube.com/@galinha667,UC2PxaZng8Q4BuzReWufGgNQ,"Oi AuthenticGames tudo bem? Provavelmente vc nao vai lembrar mais eu vou tentar mesmo assim, quando eu tinha uns 6 - 7 anos minha tia conseguiu de algum jeito vc fazer um video para mim , e nessa época eu fiquei muito feliz hoje eu tenho 12 anos e eu nunca irei te esquecer ""Fala daniel emanuel tudo bem com você? Muito obrigado por voce e sua família e que deus te abençoe,"" nao e exatamente essa frase mais foi mais ou menos isso espero que você ainda lembre de mim 
-Daniel",2024-04-23 07:34:33+00:00,2024-04-23T07:34:33Z,1,none,True,False,,,UCIPA6iWNaoetaa1T46RkzXw,0 days 07:42:49,27769.0
MFrSq1it0Es,UgyGPnesBHc-p7KDm7N4AaABAg.A0gQsFcP4csA3g0v9tVuv2,@Kauã-v9c,http://www.youtube.com/@Kau%C3%A3-v9c,UCVaJYPoHVRUiX4IBP6bl3Pw,Também vejo,2024-05-21 00:56:39+00:00,2024-05-21T00:56:39Z,1,none,True,True,UgyGPnesBHc-p7KDm7N4AaABAg,https://yt3.ggpht.com/V1bF9CzbtpQjI92YUfBD9wQO2P-oiCj6N-zub9GJv8Idit04UsS5Ej3LO99n5vYhnv60NcTg_Q=s48-c-k-c0x00ffffff-no-rj,UCIPA6iWNaoetaa1T46RkzXw,27 days 17:22:06,2395326.0
MFrSq1it0Es,Ugw7_HzpkVh_T3-KtLN4AaABAg,@Kentaroo.,http://www.youtube.com/@Kentaroo.,UC71pNQnZZ0zJQA00M7vGOhQ,Authentic vc sempre foi meu ytber preferido sempre gosto de ver seus videos,2024-05-23 16:02:45+00:00,2024-05-23T16:02:45Z,1,none,True,False,,,UCIPA6iWNaoetaa1T46RkzXw,2 days 15:06:06,227166.0
MFrSq1it0Es,Ugx0SRouv5CfgvZiVf94AaABAg,@Frontsman,http://www.youtube.com/@Frontsman,UCXLgQJt39vcfZdtjwC8mDoA,"Authentic eu te conheci la de um video que vc caiu de avião no minecreft,vc mudou muito ❤",2024-06-05 13:25:17+00:00,2024-06-05T13:25:17Z,0,none,True,False,,,UCIPA6iWNaoetaa1T46RkzXw,12 days 21:22:32,1113752.0
MFrSq1it0Es,UgxuP88hJZF2b57r4UJ4AaABAg,@Domns,http://www.youtube.com/@Domns,UCx6GI2BwjfqGRz9JlOygBng,brabo,2024-06-12 10:40:01+00:00,2024-06-12T10:40:01Z,0,none,True,False,,,UCIPA6iWNaoetaa1T46RkzXw,6 days 21:14:44,594884.0
MFrSq1it0Es,Ugw0k6N8N4AGUBpLJc94AaABAg,@mahejubiscro,http://www.youtube.com/@mahejubiscro,UCHzPxy6seOAcxiiB_AVWdHQ,"Faça isso com a dificuldade em difícil, pra ter certeza que todos vão virar zumbis",2024-06-25 13:46:25+00:00,2024-06-25T13:46:25Z,0,none,True,False,,,UCIPA6iWNaoetaa1T46RkzXw,13 days 03:06:24,1134384.0
MFrSq1it0Es,Ugzz7V1q70viAq2jeKF4AaABAg,@DcCharleynewone,http://www.youtube.com/@DcCharleynewone,UCaK6df5PC5L3jnKCv8c38Iw,Eu acompanho ele desde 2017 mais o vídeo  nao são  mais legais..,2024-06-26 15:39:47+00:00,2024-06-26T15:39:47Z,0,none,True,False,,,UCIPA6iWNaoetaa1T46RkzXw,1 days 01:53:22,93202.0
MFrSq1it0Es,UgzMiBquqnK0p_2XUSB4AaABAg,@DaviLazy6726,http://www.youtube.com/@DaviLazy6726,UCO-Gk_lh2_acPlF9aq0XovQ,Quanto tempo eu não vejo o autheticgames,2024-07-01 16:22:45+00:00,2024-07-01T16:22:45Z,0,none,True,False,,,UCIPA6iWNaoetaa1T46RkzXw,5 days 00:42:58,434578.0
MFrSq1it0Es,UgzvxrLxhcAT4CsIC614AaABAg,@DaviLazy6726,http://www.youtube.com/@DaviLazy6726,UCO-Gk_lh2_acPlF9aq0XovQ,Eu não sabia dessa,2024-07-01 16:23:10+00:00,2024-07-01T16:23:10Z,0,none,True,False,,,UCIPA6iWNaoetaa1T46RkzXw,0 days 00:00:25,25.0
MFrSq1it0Es,UgyIHqHa0yF--SatIvN4AaABAg,@PerebaGam3r2211,http://www.youtube.com/@PerebaGam3r2211,UCwHoxvBpB-HdFGITDlPzRIg,N sabia disso😮,2024-07-07 01:10:05+00:00,2024-07-07T01:10:05Z,0,none,True,False,,,UCIPA6iWNaoetaa1T46RkzXw,5 days 08:46:55,463615.0
MFrSq1it0Es,Ugy3h99MiRI-U6VfSAt4AaABAg,@Meliodas-dj3zs,http://www.youtube.com/@Meliodas-dj3zs,UChHcbIl2YB3QSP5GfZGy79A,Obrigado,2024-07-31 01:39:41+00:00,2024-07-31T01:39:41Z,0,none,True,False,,,UCIPA6iWNaoetaa1T46RkzXw,24 days 00:29:36,2075376.0
MFrSq1it0Es,Ugx6xNMjhRRt_l1ngPR4AaABAg,@pedroedelmoadventures4845,http://www.youtube.com/@pedroedelmoadventures4845,UCl4IRhrEb7G59UK6rAcZ0GA,Authentic❤,2024-08-21 17:00:54+00:00,2024-08-21T17:00:54Z,0,none,True,False,,,UCIPA6iWNaoetaa1T46RkzXw,21 days 15:21:13,1869673.0
MFrSq1it0Es,UgwYRPLwbAGMFJpfX854AaABAg,@DiogenesFelipe-k3k,http://www.youtube.com/@DiogenesFelipe-k3k,UCyf32yMQ3dfKl2UMhEtCwxQ,Outra coisa que tu pode fazer é salvar de invasão imagina usando os dois juntos,2024-08-26 20:28:59+00:00,2024-08-26T20:28:59Z,0,none,True,False,,,UCIPA6iWNaoetaa1T46RkzXw,5 days 03:28:05,444485.0
MFrSq1it0Es,UgxY8Dx0dnP2clfOELl4AaABAg,@fulano1234,http://www.youtube.com/@fulano1234,UCZem7gxkcsSuUsbfXxhlgBg,Uma coisa que não foi mencionada e que para fazer o villager virar zumbi e necessário mudar para o modo difícil.,2024-09-23 17:59:00+00:00,2024-09-23T17:59:00Z,0,none,True,False,,,UCIPA6iWNaoetaa1T46RkzXw,27 days 21:30:01,2410201.0
MFrSq1it0Es,UgxWSbNUWy0peQXlMGJ4AaABAg,@XxGabrielGoj0xX,http://www.youtube.com/@XxGabrielGoj0xX,UCkRTjqIGij_5WlaZvpUkspg,"Obrigado authentic por ter completado minha infância,vc é o maior canal de mincraft do brasil e sempre sera,Vlw authentic❤",2025-01-31 03:35:15+00:00,2025-01-31T03:35:15Z,0,none,True,False,,,UCIPA6iWNaoetaa1T46RkzXw,129 days 09:36:15,11180175.0
MFrSq1it0Es,Ugz6AD_eVN2RkYq8ZZZ4AaABAg,@me.nota.AuthenticGames,http://www.youtube.com/@me.nota.AuthenticGames,UCobW6vbnBnbk60pIkdexF-A,Eu já sabia em😊,2025-03-23 12:30:47+00:00,2025-03-23T12:30:47Z,0,none,True,False,,,UCIPA6iWNaoetaa1T46RkzXw,51 days 08:55:32,4438532.0
