video_id,comment_id,author,author_channel_url,author_channel_id,comment,published_at,updated_at,like_count,viewer_rating,can_rate,is_reply,parent_id,author_profile_image_url,channel_id,inter-arrival-time,inter-arrival-time-seconds
MFrSq1it0Es,UgwFtsvlpHTnEC_gyGh4AaABAg,@hotdogbr2,http://www.youtube.com/@hotdogbr2,UCa2fwWbs-_c9D5xbzp9X8SA,"Esses villagers ladrão 😠, agora com a sua dica eu não teria que pagar 54 esmeralda em um livro apenas! obrigado por sempre estar ajudando TT!",2024-03-07 15:03:03+00:00,2024-03-07T15:03:03Z,0,none,True,False,,,UCIPA6iWNaoetaa1T46RkzXw,,
MFrSq1it0Es,UgwztjOwzJVfH1HY8FR4AaABAg,@Zane508,http://www.youtube.com/@Zane508,UCi3v2D7mU-hvL12J4tIuzqw,😊😊,2024-03-07 15:04:52+00:00,2024-03-07T15:04:52Z,0,none,True,False,,,UCIPA6iWNaoetaa1T46RkzXw,0 days 00:01:49,109.0
MFrSq1it0Es,UgwH2F3vS6a97VIfhSF4AaABAg,@Zane508,http://www.youtube.com/@Zane508,UCi3v2D7mU-hvL12J4tIuzqw,Incrível,2024-03-07 15:05:00+00:00,2024-03-07T15:05:00Z,0,none,True,False,,,UCIPA6iWNaoetaa1T46RkzXw,0 days 00:00:08,8.0
MFrSq1it0Es,Ugx33lI8eCNdaVFCEih4AaABAg,@belnaldu-2974,http://www.youtube.com/@belnaldu-2974,UCziS8rVaGE4dnX4Shr_8_vQ,"Oi Authentic! Obrigado por sua dica, eu não sabia disso... Me ajudou muito!",2024-03-07 15:07:58+00:00,2024-03-07T15:07:58Z,0,none,True,False,,,UCIPA6iWNaoetaa1T46RkzXw,0 days 00:02:58,178.0
MFrSq1it0Es,UgyGPnesBHc-p7KDm7N4AaABAg,@Victorzin123,http://www.youtube.com/@Victorzin123,UCED5jorcn-Yon6H0xL9u0PA,"AuthenticGames, eu te vejo dês de pequeno, com uns 3 ou 4 anos, você é um dos meus Youtubers favoritos, e está no topo ❤",2024-03-07 15:09:16+00:00,2024-03-07T15:09:16Z,54,none,True,False,,,UCIPA6iWNaoetaa1T46RkzXw,0 days 00:01:18,78.0
MFrSq1it0Es,Ugw1KlXvQtaG3fGncX54AaABAg,@Shimprinho,http://www.youtube.com/@Shimprinho,UCbjsYJOX0u9hTZSRoJqYhKg,É triste ver um youtuber tão bom com as views caindo😔,2024-03-07 15:15:15+00:00,2024-03-07T15:15:15Z,0,none,True,False,,,UCIPA6iWNaoetaa1T46RkzXw,0 days 00:05:59,359.0
MFrSq1it0Es,Ugx6xvWVvNhnnFwPVzJ4AaABAg,@andreiacotrim7650,http://www.youtube.com/@andreiacotrim7650,UCoa5ExSPjqJwQdLy54kA1Pw,Eu.  Te.   Vi.   Um.    Brinquedo.    De.    Vc.    Lá.   No.      Super.   Mercado😊😊😊😊😊😊😊😊❤❤❤❤😀😄😁😃😀😄😁😃🌹❤️😀😃🌹😄🌺🎁💝🌷thua🥳,2024-03-07 15:19:36+00:00,2024-03-07T15:19:36Z,0,none,True,False,,,UCIPA6iWNaoetaa1T46RkzXw,0 days 00:04:21,261.0
MFrSq1it0Es,UgzxT0ZFRIKsSkEQLBp4AaABAg,@EdVerse.z.original,http://www.youtube.com/@EdVerse.z.original,UCpCMiLsGXHo_FjTHO6QBLxA,"Caramba, valeu pela dica TT, que Deus te ilumine",2024-03-07 15:47:39+00:00,2024-03-07T15:47:39Z,5,none,True,False,,,UCIPA6iWNaoetaa1T46RkzXw,0 days 00:28:03,1683.0
MFrSq1it0Es,UgySgKIsKHWQGVszEZx4AaABAg,@Miguel_Prado1357,http://www.youtube.com/@Miguel_Prado1357,UCJkO2QFN7fMVWqHKpm0ajkg,Omg,2024-03-07 15:50:43+00:00,2024-03-07T15:50:43Z,0,none,True,False,,,UCIPA6iWNaoetaa1T46RkzXw,0 days 00:03:04,184.0
MFrSq1it0Es,Ugz87kE8Rnxz7oqPVfN4AaABAg,@TuppyMSM,http://www.youtube.com/@TuppyMSM,UCJljfB7mzlriGcBC7xVTkPA,TT... 😢,2024-03-07 16:06:15+00:00,2024-03-07T16:06:15Z,0,none,True,False,,,UCIPA6iWNaoetaa1T46RkzXw,0 days 00:15:32,932.0
MFrSq1it0Es,UgxDZUYgYVT3DTEaT814AaABAg,@Steven-me8bt,http://www.youtube.com/@Steven-me8bt,UCbT0L0DBiRoW5gom0SSMWFg,obrigado authentic por fazer parte da minha infância,2024-03-07 16:15:40+00:00,2024-03-07T16:15:40Z,17,none,True,False,,,UCIPA6iWNaoetaa1T46RkzXw,0 days 00:09:25,565.0
MFrSq1it0Es,UgzmrKzgMiuD-ZpIfJZ4AaABAg,@monkeydrenan6531,http://www.youtube.com/@monkeydrenan6531,UCJOmBXu-b-HpRMHo60J7big,o cara saba dms,2024-03-07 16:29:54+00:00,2024-03-07T16:29:54Z,0,none,True,False,,,UCIPA6iWNaoetaa1T46RkzXw,0 days 00:14:14,854.0
MFrSq1it0Es,UgyrwOujUJOZAEtXA5t4AaABAg,@L4_pedroelias,http://www.youtube.com/@L4_pedroelias,UCvD6xailsvCZ6qOul9StjNQ,Obrigado pela a ajuda TT pela q dica,2024-03-07 16:39:25+00:00,2024-03-07T16:39:25Z,0,none,True,False,,,UCIPA6iWNaoetaa1T46RkzXw,0 days 00:09:31,571.0
MFrSq1it0Es,UgwA-u72RB95uWQ7naN4AaABAg,@Shad0WShad0W0,http://www.youtube.com/@Shad0WShad0W0,UCk0AmwmT5JiXMjglckZLo9w,MELHOR YOUTUBERR!!!!,2024-03-07 16:53:41+00:00,2024-03-07T16:53:41Z,2,none,True,False,,,UCIPA6iWNaoetaa1T46RkzXw,0 days 00:14:16,856.0
MFrSq1it0Es,Ugw-XFOjabDcqtmSIE14AaABAg,@astrogamer1506,http://www.youtube.com/@astrogamer1506,UCowTOkGPWVPuJKauPba0TZw,"Vc Marou mimha infancia, Marco Túlio❤❤❤ te via quando era uma criancinha pequena, e vc ainda faz muito historia ❤❤ ""Fala ae galera, mais um vídeo aqui do canal, AuthenticGames"" que época boa❤❤😊😊 TE AMO KIRIDUUUUUUU 😍😍 que Deus sempre abençoe ❤❤ n estou muito atualizado mas... O Shake ainda esta com vc?? Aquele fofo rs",2024-03-07 17:16:10+00:00,2024-03-07T17:18:49Z,2,none,True,False,,,UCIPA6iWNaoetaa1T46RkzXw,0 days 00:22:29,1349.0
MFrSq1it0Es,Ugw1KlXvQtaG3fGncX54AaABAg.A0gRZ6YuyXgA0gquWub15r,@Finnmine-g7w,http://www.youtube.com/@Finnmine-g7w,UCEuaYdRB66_LZbUUyIVKByw,"É por causa do Mike , que fez cair bastante a Views do authentic",2024-03-07 19:05:30+00:00,2024-03-07T19:05:30Z,0,none,True,True,Ugw1KlXvQtaG3fGncX54AaABAg,https://yt3.ggpht.com/SMmwONSccJ9i2jTXswpTLj0Z7kY1HMHgoy_-rPdrUhIJNpeHoKzQju2h3dDBWYjTM3t2oqWoAg=s48-c-k-c0x00ffffff-no-rj,UCIPA6iWNaoetaa1T46RkzXw,0 days 01:49:20,6560.0
MFrSq1it0Es,UgxcOjcg73BdjUsEQnJ4AaABAg,@igorthomazlaufer6002,http://www.youtube.com/@igorthomazlaufer6002,UCLP1pD3REeub3WRh7FqP7LA,Mano eu via seus vídeos desde pequeno e sempre tive livro brinquedos,2024-03-07 20:20:22+00:00,2024-03-07T20:20:22Z,2,none,True,False,,,UCIPA6iWNaoetaa1T46RkzXw,0 days 01:14:52,4492.0
MFrSq1it0Es,UgzufAR6jEzVI-ZF0YZ4AaABAg,@Snow_BR009,http://www.youtube.com/@Snow_BR009,UC9MJxQthk4ms_Fr8Z5u4pOQ,"Authenticgames, você e incrivel cara, muito obrigado pelo seus otimos videos e marcar minha infância, tmj mano",2024-03-07 21:07:29+00:00,2024-03-07T21:07:29Z,3,none,True,False,,,UCIPA6iWNaoetaa1T46RkzXw,0 days 00:47:07,2827.0
MFrSq1it0Es,UgyeGzmNzdc7i20Lz6R4AaABAg,@PedroNeckel,http://www.youtube.com/@PedroNeckel,UChMr-ZvfiJ9wHmVECG6OPsw,AutheticGames e o Minecraft deserto 🏜️?,2024-03-07 21:11:15+00:00,2024-03-07T21:11:15Z,0,none,True,False,,,UCIPA6iWNaoetaa1T46RkzXw,0 days 00:03:46,226.0
MFrSq1it0Es,UgzCgHeXhD9QFkC2QVd4AaABAg,@Luckanim,http://www.youtube.com/@Luckanim,UCeToiuqPpPiJAB5jBboadtg,Mn vc mudou muito vc e muito bom nos seus vídeos sempre queria um chinelo seu,2024-03-07 21:17:25+00:00,2024-03-07T21:17:25Z,3,none,True,False,,,UCIPA6iWNaoetaa1T46RkzXw,0 days 00:06:10,370.0
MFrSq1it0Es,Ugwr-Gu-FHRplOlocSl4AaABAg,@KLSeyRandom,http://www.youtube.com/@KLSeyRandom,UC7xsH3O7BNOzKQH5sLrim9A,"Obg^^, n sabia que eles engana😅",2024-03-07 21:47:10+00:00,2024-03-07T21:47:10Z,2,none,True,False,,,UCIPA6iWNaoetaa1T46RkzXw,0 days 00:29:45,1785.0
MFrSq1it0Es,Ugw1KlXvQtaG3fGncX54AaABAg.A0gRZ6YuyXgA0h9m4cXoQ2,@aleatorio-14,http://www.youtube.com/@aleatorio-14,UCEeAmByU02S0znO3cp_OOsw,Sdds de 2016 e 2019...,2024-03-07 21:59:07+00:00,2024-03-07T21:59:07Z,0,none,True,True,Ugw1KlXvQtaG3fGncX54AaABAg,https://yt3.ggpht.com/Ib0vxD9W7xKVwhmdBvxGFPhqaGMKLqr5Zh17RZQMKfoDsw84scjYRxnD2TPh00o0L-8_H4qM1w=s48-c-k-c0x00ffffff-no-rj,UCIPA6iWNaoetaa1T46RkzXw,0 days 00:11:57,717.0
MFrSq1it0Es,Ugxs84eVAhWEdLytNVd4AaABAg,@aleatorio-14,http://www.youtube.com/@aleatorio-14,UCEeAmByU02S0znO3cp_OOsw,Saudades da epoca de 2016 e 2019...,2024-03-07 21:59:25+00:00,2024-03-07T21:59:25Z,0,none,True,False,,,UCIPA6iWNaoetaa1T46RkzXw,0 days 00:00:18,18.0
MFrSq1it0Es,UgwafgT7e8Mm6_PQ4ZF4AaABAg,@gabrielperini9361,http://www.youtube.com/@gabrielperini9361,UCK5SF498j6yJEgyRNzsoUww,Mano o seu canal e dahora,2024-03-07 22:37:43+00:00,2024-03-07T22:37:43Z,0,none,True,False,,,UCIPA6iWNaoetaa1T46RkzXw,0 days 00:38:18,2298.0
MFrSq1it0Es,UgzlyoNq5kBhJQpqt2d4AaABAg,@JvzinWp,http://www.youtube.com/@JvzinWp,UCygr15sMe-J5H_fgqichdTw,Vou testar TT Deus te abençoe,2024-03-07 22:38:25+00:00,2024-03-07T22:38:25Z,0,none,True,False,,,UCIPA6iWNaoetaa1T46RkzXw,0 days 00:00:42,42.0
MFrSq1it0Es,UgwcWVa9fci2hAElIPd4AaABAg,@CaiuaNet00,http://www.youtube.com/@CaiuaNet00,UCpJoVxsXiYwmE10QYmdZEiw,"100% de chance no modo difícil, é isso de 1 esmeralda por troca era só um ""bug""",2024-03-07 22:59:37+00:00,2024-03-07T22:59:37Z,0,none,True,False,,,UCIPA6iWNaoetaa1T46RkzXw,0 days 00:21:12,1272.0
MFrSq1it0Es,UgwFmMjZmoAJlnDFXrJ4AaABAg,@jabuticabaa9988,http://www.youtube.com/@jabuticabaa9988,UCTCx_vKCeCVavABGYLgUiqw,"Você faz toda uma gambiarra pra poder fazer seus villages virarem zumbis, e a mojang tira a opção de transformar ele varias vezes pra as trocas ficarem penas com 1 esmeralda 😢",2024-03-07 23:07:42+00:00,2024-03-07T23:07:42Z,1,none,True,False,,,UCIPA6iWNaoetaa1T46RkzXw,0 days 00:08:05,485.0
MFrSq1it0Es,UgzHb7IZZSGQlUKsJzd4AaABAg,@cynthiavalmori,http://www.youtube.com/@cynthiavalmori,UCs8umkSFDZ0377L1UBZDHkg,TT eu amo seus videos manda um grande avraso ao mano spok ea toda familia craft eu sou maninho❤,2024-03-07 23:31:07+00:00,2024-03-07T23:31:07Z,1,none,True,False,,,UCIPA6iWNaoetaa1T46RkzXw,0 days 00:23:25,1405.0
MFrSq1it0Es,UgzlyoNq5kBhJQpqt2d4AaABAg.A0hEGw11cw5A0hLXhRPpuV,@AuthenticGames,http://www.youtube.com/@AuthenticGames,UCIPA6iWNaoetaa1T46RkzXw,Deu certo?,2024-03-07 23:41:52+00:00,2024-03-07T23:41:52Z,0,none,True,True,UgzlyoNq5kBhJQpqt2d4AaABAg,https://yt3.ggpht.com/OTToktW_fdew6vLD8KAGOKmcFmvwi9pnlzUo9sQcJmY43LxbBYoH5gRsz5FNhOf2ImNn9vLNWtE=s48-c-k-c0x00ffffff-no-rj,UCIPA6iWNaoetaa1T46RkzXw,0 days 00:10:45,645.0
MFrSq1it0Es,UgzJE7UaCfVQLEwHIBx4AaABAg,@Susu_bestplayer8,http://www.youtube.com/@Susu_bestplayer8,UCCJhy74UjBmg96DL2IrNoKA,Como e bom ver meu YouTube e favorito ainda fazendo os melhores videos da melhor qualidade muito obg authentic tu e o melhor,2024-03-08 00:19:06+00:00,2024-03-08T00:19:19Z,0,none,True,False,,,UCIPA6iWNaoetaa1T46RkzXw,0 days 00:37:14,2234.0
MFrSq1it0Es,Ugz_h9Uw-GgXw9k0LhZ4AaABAg,@artzphm,http://www.youtube.com/@artzphm,UCWuiuyh_v0foUBqf0sEIgvg,"Opa, talvez você não leia esse comentário, mas espero que leia… Te acompanho desde quando eu tinha 5 anos, ou seja, há 7 anos atrás vi pela primeira vez um vídeo seu, você foi um herói pra mim e pra minha infância, espero que sempre esteja feliz fazendo seus vídeos, e bom crescimento de volta, seu canal tá retornando, tô sentindo!",2024-03-08 02:01:41+00:00,2024-03-08T02:01:41Z,0,none,True,False,,,UCIPA6iWNaoetaa1T46RkzXw,0 days 01:42:35,6155.0
MFrSq1it0Es,UgxXdbflvTGmD2XnNid4AaABAg,@pedrohenrique72126,http://www.youtube.com/@pedrohenrique72126,UCI0DIKv6LzRS3U1zF6f2izw,oi authenticgames posso entra familiacraft por favor amigo,2024-03-08 04:05:06+00:00,2024-03-08T04:05:06Z,1,none,True,False,,,UCIPA6iWNaoetaa1T46RkzXw,0 days 02:03:25,7405.0
MFrSq1it0Es,Ugz_h9Uw-GgXw9k0LhZ4AaABAg.A0haXfTMpStA0hrqCkeTpg,@AuthenticGames,http://www.youtube.com/@AuthenticGames,UCIPA6iWNaoetaa1T46RkzXw,Que honra!,2024-03-08 04:32:54+00:00,2024-03-08T04:32:54Z,1,none,True,True,Ugz_h9Uw-GgXw9k0LhZ4AaABAg,https://yt3.ggpht.com/OTToktW_fdew6vLD8KAGOKmcFmvwi9pnlzUo9sQcJmY43LxbBYoH5gRsz5FNhOf2ImNn9vLNWtE=s48-c-k-c0x00ffffff-no-rj,UCIPA6iWNaoetaa1T46RkzXw,0 days 00:27:48,1668.0
MFrSq1it0Es,UgxbyTa4JhtmC8SlA3V4AaABAg,@tsuu....,http://www.youtube.com/@tsuu....,UC9byIzVT9LZD423dgrwSOqw,"Authentic, por favor responda. Tem alguma chance de as séries antigas voltarem?",2024-03-08 13:28:56+00:00,2024-03-08T13:28:56Z,0,none,True,False,,,UCIPA6iWNaoetaa1T46RkzXw,0 days 08:56:02,32162.0
MFrSq1it0Es,UgxAtkwn8PqivifV8h14AaABAg,@groot873,http://www.youtube.com/@groot873,UCgPlsJxDrmE7BEnYZl5RfDw,caramba dessa eu nao sabia,2024-03-08 15:21:18+00:00,2024-03-08T15:21:18Z,1,none,True,False,,,UCIPA6iWNaoetaa1T46RkzXw,0 days 01:52:22,6742.0
MFrSq1it0Es,UgyHxG6RgcPcZ3wzcN54AaABAg,@beatrizfagundes1453,http://www.youtube.com/@beatrizfagundes1453,UCuGVOdqHoz1bkg77MY48-XQ,Authenticgames.....pfvv volta joga pique-esconde com o pok caue jazz e o jovem só muito seu fá❤,2024-03-08 15:33:06+00:00,2024-03-08T15:33:06Z,0,none,True,False,,,UCIPA6iWNaoetaa1T46RkzXw,0 days 00:11:48,708.0
MFrSq1it0Es,UgwF8_WMXH4izReo4qd4AaABAg,@Lagalhfh,http://www.youtube.com/@Lagalhfh,UCgwjyatnVjoB4TTVlaliwnw,Valeu,2024-03-08 16:24:57+00:00,2024-03-08T16:24:57Z,0,none,True,False,,,UCIPA6iWNaoetaa1T46RkzXw,0 days 00:51:51,3111.0
MFrSq1it0Es,UgxycOCC8Q91uI1kBl14AaABAg,@Lagalhfh,http://www.youtube.com/@Lagalhfh,UCgwjyatnVjoB4TTVlaliwnw,Ajudou muito,2024-03-08 16:25:08+00:00,2024-03-08T16:25:08Z,0,none,True,False,,,UCIPA6iWNaoetaa1T46RkzXw,0 days 00:00:11,11.0
MFrSq1it0Es,UgxuMooRvkIIVgWKyrl4AaABAg,@LeviRodrigues1234,http://www.youtube.com/@LeviRodrigues1234,UCNHoXwZUVbjethOipIOWw9A,Você é o melhor canal de Minecraft Fixa por favor,2024-03-08 23:48:16+00:00,2024-03-08T23:48:43Z,1,none,True,False,,,UCIPA6iWNaoetaa1T46RkzXw,0 days 07:23:08,26588.0
MFrSq1it0Es,UgzmIYA_lnCYDwkoPbV4AaABAg,@Pama_editz,http://www.youtube.com/@Pama_editz,UCfAxrQzbwqsVhBTHyjmhU8w,Mano eu gosto demais do seu canal eu te assisto desde os 8 anos kk,2024-03-09 01:31:54+00:00,2024-03-09T01:31:54Z,0,none,True,False,,,UCIPA6iWNaoetaa1T46RkzXw,0 days 01:43:38,6218.0
MFrSq1it0Es,UgzlHUO5uhJ8iT2Npdp4AaABAg,@gi.skawly,http://www.youtube.com/@gi.skawly,UCzu6dM5UG5dErbzGGWf9jRA,te amo authentic ❤,2024-03-09 02:52:16+00:00,2024-03-09T02:52:16Z,0,none,True,False,,,UCIPA6iWNaoetaa1T46RkzXw,0 days 01:20:22,4822.0
MFrSq1it0Es,UgyVLEeN5X22cWBiipx4AaABAg,@Tomate938,http://www.youtube.com/@Tomate938,UCxEgWLoxzAl849DV2imuGvg,Vlw authentic! Deus te abençoe,2024-03-09 12:27:57+00:00,2024-03-09T12:27:57Z,0,none,True,False,,,UCIPA6iWNaoetaa1T46RkzXw,0 days 09:35:41,34541.0
MFrSq1it0Es,UgzBuqZu3ycI6SJ1SMh4AaABAg,@pedrogames756,http://www.youtube.com/@pedrogames756,UCFPKSerJZsS6uTSbpgNKFIg,Mano vc traz dicas muito boas agora não vou mais cair nessas dos Villagers,2024-03-09 15:28:15+00:00,2024-03-09T15:28:15Z,2,none,True,False,,,UCIPA6iWNaoetaa1T46RkzXw,0 days 03:00:18,10818.0
MFrSq1it0Es,UgyVLEeN5X22cWBiipx4AaABAg.A0lI-VI-wHHA0lez7qI2Xo,@AuthenticGames,http://www.youtube.com/@AuthenticGames,UCIPA6iWNaoetaa1T46RkzXw,Todos nós 👊🏽,2024-03-09 15:57:29+00:00,2024-03-09T15:57:29Z,0,none,True,True,UgyVLEeN5X22cWBiipx4AaABAg,https://yt3.ggpht.com/OTToktW_fdew6vLD8KAGOKmcFmvwi9pnlzUo9sQcJmY43LxbBYoH5gRsz5FNhOf2ImNn9vLNWtE=s48-c-k-c0x00ffffff-no-rj,UCIPA6iWNaoetaa1T46RkzXw,0 days 00:29:14,1754.0
MFrSq1it0Es,UgxawQ6D3QX9g_BFpAl4AaABAg,@Toddyfy,http://www.youtube.com/@Toddyfy,UCUJz9QBh5UuRHmL9zutEE1w,"Authentic, você pretende continuar com as intros do canal como antigamente??",2024-03-09 16:46:27+00:00,2024-03-09T16:46:27Z,0,none,True,False,,,UCIPA6iWNaoetaa1T46RkzXw,0 days 00:48:58,2938.0
MFrSq1it0Es,Ugz_h9Uw-GgXw9k0LhZ4AaABAg.A0haXfTMpStA0lpviyGe9C,@Marcodujdjfjf,http://www.youtube.com/@Marcodujdjfjf,UCic26Ep-oiZz5hXAvGNI4Dg,​@@AuthenticGames😊😊,2024-03-09 17:33:08+00:00,2024-06-18T03:49:30Z,0,none,True,True,Ugz_h9Uw-GgXw9k0LhZ4AaABAg,https://yt3.ggpht.com/cTMmRf7ySht2gNc467Emqn6fDCLtZitIv0yjRKBrApeICuAADr20yi4p4u_MTGpNA9kgBWIfw5M=s48-c-k-c0x00ffffff-no-rj,UCIPA6iWNaoetaa1T46RkzXw,0 days 00:46:41,2801.0
MFrSq1it0Es,UgxWMiCAqrE23DVzmSh4AaABAg,@piettro77,http://www.youtube.com/@piettro77,UCmu4YVX5E6poyKPldnr2pIw,Ja deixei o like vou compartilhar seu canal❤❤❤❤❤❤ acompanho desde 2014 TT🤙,2024-03-09 18:13:29+00:00,2024-03-09T18:13:29Z,1,none,True,False,,,UCIPA6iWNaoetaa1T46RkzXw,0 days 00:40:21,2421.0
MFrSq1it0Es,Ugxxhm_ulMgzfzI9EuJ4AaABAg,@PedrobløXXX,http://www.youtube.com/@Pedrobl%C3%B8XXX,UC-gzqoVwovUsKgVl0EFAcNA,"Opa Authentic, mano te assistia desde de criança com a minha vó, ela nunca lembrava seu nome, daí eu falava ""aquele da camisa listrada azul"" e ela lembrava kkkk, bom, indo pra outro assunto, percebi que não sinto a mesma coisa que sentia vendo seus vídeos quando criança, eles não me fazer rir tanto, acho que eu mudei bastante... Mas isso não significa que eu não gosto de vc. 
Olha, vc fez uma parte incrível da minha infância junto com o TazerCraft. 
Com certeza eu séria bem feliz se vc pudesse fazer vídeos com os youtubers de hoje em dia, como o Problems, ele até falou em um vídeo que vc o ajudou no pvp do mine",2024-03-09 19:26:12+00:00,2024-03-09T19:26:12Z,0,none,True,False,,,UCIPA6iWNaoetaa1T46RkzXw,0 days 01:12:43,4363.0
MFrSq1it0Es,UgxhedTGtEslnE3X_nJ4AaABAg,@brendonunes4013,http://www.youtube.com/@brendonunes4013,UC4JLWIxp8sSpYwgug6raryA,Authentic sou seu fã número 1 acabei de fazer meu aniversário de 11 anos por vavornunca pare de postar vídeo eu de assisto quando eu nem sabia ler nem escrever seus vídeos antigos do drone seu personagem do mine indo até na sua casa lembro o meu irmão colocando por que não sabia escrever,2024-03-09 19:34:24+00:00,2024-03-09T19:34:24Z,1,none,True,False,,,UCIPA6iWNaoetaa1T46RkzXw,0 days 00:08:12,492.0
MFrSq1it0Es,UgxhedTGtEslnE3X_nJ4AaABAg.A0m2nuLlvPhA0m2wtj73CU,@brendonunes4013,http://www.youtube.com/@brendonunes4013,UC4JLWIxp8sSpYwgug6raryA,Quanto você meu aniversário de 12 anos vou escrever no seu último vídeo sou de São josé dos campos,2024-03-09 19:35:37+00:00,2024-03-09T19:35:37Z,0,none,True,True,UgxhedTGtEslnE3X_nJ4AaABAg,https://yt3.ggpht.com/IZvmgPC9k_7q6Pcrg2sKp3JniYPW6yxoNI1FT7Zn78DizkQWr8HK5Y28mGQxIKHamcMa-o9jFQ=s48-c-k-c0x00ffffff-no-rj,UCIPA6iWNaoetaa1T46RkzXw,0 days 00:01:13,73.0
MFrSq1it0Es,UgzzpyId3I704c5_mKF4AaABAg,@arthurmariano4287,http://www.youtube.com/@arthurmariano4287,UCcPoNLKAqrBRHttdSpkGw_w,Authentic não desista volta a fazer séries de polícia e ladrao,2024-03-09 20:16:36+00:00,2024-03-09T20:16:36Z,0,none,True,False,,,UCIPA6iWNaoetaa1T46RkzXw,0 days 00:40:59,2459.0
MFrSq1it0Es,Ugy1ibeVBhYhar66rKp4AaABAg,@Ben10minegamer8,http://www.youtube.com/@Ben10minegamer8,UCxAD8d1f4lv15hxFr-ejzPQ,Tenho seu bonéco vou tomar cuidado,2024-03-09 22:10:29+00:00,2024-03-09T22:10:29Z,1,none,True,False,,,UCIPA6iWNaoetaa1T46RkzXw,0 days 01:53:53,6833.0
MFrSq1it0Es,Ugx7NikR-iTqXQnbT9d4AaABAg,@junior100pro8,http://www.youtube.com/@junior100pro8,UC9wbqXK00A_JAE6t-630IGg,Authentic stonks,2024-03-09 23:50:09+00:00,2024-03-09T23:50:09Z,0,none,True,False,,,UCIPA6iWNaoetaa1T46RkzXw,0 days 01:39:40,5980.0
MFrSq1it0Es,UgxWMiCAqrE23DVzmSh4AaABAg.A0luYHGyNKmA0ma-V09QiI,@AuthenticGames,http://www.youtube.com/@AuthenticGames,UCIPA6iWNaoetaa1T46RkzXw,Obrigado pelo like 👊🏽,2024-03-10 00:33:13+00:00,2024-03-10T00:33:13Z,1,none,True,True,UgxWMiCAqrE23DVzmSh4AaABAg,https://yt3.ggpht.com/OTToktW_fdew6vLD8KAGOKmcFmvwi9pnlzUo9sQcJmY43LxbBYoH5gRsz5FNhOf2ImNn9vLNWtE=s48-c-k-c0x00ffffff-no-rj,UCIPA6iWNaoetaa1T46RkzXw,0 days 00:43:04,2584.0
MFrSq1it0Es,UgxWMiCAqrE23DVzmSh4AaABAg.A0luYHGyNKmA0maPiotLnO,@piettro77,http://www.youtube.com/@piettro77,UCmu4YVX5E6poyKPldnr2pIw,@@AuthenticGames 👊,2024-03-10 00:36:48+00:00,2024-04-18T02:06:19Z,0,none,True,True,UgxWMiCAqrE23DVzmSh4AaABAg,https://yt3.ggpht.com/GD5qEao9J06hdiUsHkCwGy2TQqgPvVhXsizJ6krO1fsFohFiK9yXONdNO_RyXnB1GTD6rZclvQ=s48-c-k-c0x00ffffff-no-rj,UCIPA6iWNaoetaa1T46RkzXw,0 days 00:03:35,215.0
MFrSq1it0Es,UgwJDCrmY7J0Ihn_CSp4AaABAg,@imperialofimune,http://www.youtube.com/@imperialofimune,UCDfJ9H2iQd1igXGoXUjAgkA,Caraca vlw pela dica tt,2024-03-10 01:15:18+00:00,2024-03-10T01:15:18Z,0,none,True,False,,,UCIPA6iWNaoetaa1T46RkzXw,0 days 00:38:30,2310.0
MFrSq1it0Es,Ugwc7HJOeKAZdKA1uJx4AaABAg,@yogacombeafranco,http://www.youtube.com/@yogacombeafranco,UCUvyGIP_iKGhZCQnc96lDHw,"AuthenticGames, eu te via des de os 4 anos mas sinto falta dos seus vídeos antigos 😢",2024-03-10 01:17:59+00:00,2024-03-10T01:17:59Z,0,none,True,False,,,UCIPA6iWNaoetaa1T46RkzXw,0 days 00:02:41,161.0
MFrSq1it0Es,UgyJw4E7JZcWjT8ym-94AaABAg,@Patu12375,http://www.youtube.com/@Patu12375,UCwpuPLiLK_odfPDCf09RhRQ,"AuthenticGames vc fez oq ngm faria,minha infância assisto vc des de 2018 mano vc é incrível,n tenho palavras pra dizer o quanto vc me fez feliz obrigado por tudo.

Se ler por favor manda salve sempre foi meu sonho, aliás continue com vídeos longos e curtos faça a infância de mais pessoas.",2024-03-10 03:03:05+00:00,2024-08-24T15:30:58Z,6,none,True,False,,,UCIPA6iWNaoetaa1T46RkzXw,0 days 01:45:06,6306.0
MFrSq1it0Es,UgwJDCrmY7J0Ihn_CSp4AaABAg.A0meojCbzcQA0n-FxZa47C,@AuthenticGames,http://www.youtube.com/@AuthenticGames,UCIPA6iWNaoetaa1T46RkzXw,Espero ter ajudado,2024-03-10 04:22:39+00:00,2024-03-10T04:22:39Z,0,none,True,True,UgwJDCrmY7J0Ihn_CSp4AaABAg,https://yt3.ggpht.com/OTToktW_fdew6vLD8KAGOKmcFmvwi9pnlzUo9sQcJmY43LxbBYoH5gRsz5FNhOf2ImNn9vLNWtE=s48-c-k-c0x00ffffff-no-rj,UCIPA6iWNaoetaa1T46RkzXw,0 days 01:19:34,4774.0
MFrSq1it0Es,UgxePlLwGMrTUfPRvuF4AaABAg,@lenda8712,http://www.youtube.com/@lenda8712,UCKDX_aVMhLZOVqR5lT_Oy6Q,"Oi athentcgames,eu te vejo a muito tempo faz um favor volta a gravar rafy ou gravar video muito bons fe mine craft e esse dia que vc gravou era o meu aniversário",2024-03-10 14:37:52+00:00,2024-03-10T14:37:52Z,0,none,True,False,,,UCIPA6iWNaoetaa1T46RkzXw,0 days 10:15:13,36913.0
MFrSq1it0Es,UgxUzIjJlLupYmF1kLh4AaABAg,@eduardolang3817,http://www.youtube.com/@eduardolang3817,UCtVB3wzBFM69chYrm8LUNnw,Opa authentic sou seu fã e gosto muito de você!,2024-03-10 15:54:52+00:00,2024-03-10T15:54:52Z,0,none,True,False,,,UCIPA6iWNaoetaa1T46RkzXw,0 days 01:17:00,4620.0
MFrSq1it0Es,UgzCyUGbl5HCYUUWyHd4AaABAg,@Desconhecido53,http://www.youtube.com/@Desconhecido53,UCzUQHjdmzT6dcYpwLjEkfXQ,Quem lembra do Jp plays😢,2024-03-10 16:26:50+00:00,2024-03-10T16:26:57Z,0,none,True,False,,,UCIPA6iWNaoetaa1T46RkzXw,0 days 00:31:58,1918.0
MFrSq1it0Es,UgzqEmhjGQ-5ZMetYUN4AaABAg,@golden___00,http://www.youtube.com/@golden___00,UCr956uCByqwnrfWQBmC6qXg,"Authentic cara você marcou minha infancia na epoca da escola monstro orfanato mapa do herobrine etc
Você é um yt mt bom",2024-03-10 17:45:44+00:00,2024-03-10T17:46:05Z,1,none,True,False,,,UCIPA6iWNaoetaa1T46RkzXw,0 days 01:18:54,4734.0
MFrSq1it0Es,UgxwoX4AWUdAN9lAgmN4AaABAg,@gustavogutierrez5508,http://www.youtube.com/@gustavogutierrez5508,UCnqEcK3bKQd7qqfzv19EmrA,"AuthenticGames, você foi uns dos primeiros canais que assisti Minecraft, sinto saudades do aventuras com mods, obrigado por tudo",2024-03-10 20:27:10+00:00,2024-03-10T20:27:10Z,1,none,True,False,,,UCIPA6iWNaoetaa1T46RkzXw,0 days 02:41:26,9686.0
MFrSq1it0Es,UgxGujlpXxbrfK4HWvV4AaABAg,@L7.PRO00,http://www.youtube.com/@L7.PRO00,UCjlKT5eybcacf4LxGAkNlyQ,Mapas q vão estar em nossos corações:namorada perfeita casa dos youtubers perdidos o mapa de médico,2024-03-11 01:26:45+00:00,2024-03-11T01:26:45Z,0,none,True,False,,,UCIPA6iWNaoetaa1T46RkzXw,0 days 04:59:35,17975.0
MFrSq1it0Es,Ugw-KgeEW2M7Jme7A2J4AaABAg,@Guininja08,http://www.youtube.com/@Guininja08,UCCSGxPJe-wCJPP1TQyd5NIg,TT fais serie com seus amigos,2024-03-11 11:20:58+00:00,2024-03-11T11:20:58Z,0,none,True,False,,,UCIPA6iWNaoetaa1T46RkzXw,0 days 09:54:13,35653.0
MFrSq1it0Es,UgwjXsgAWVPzibFM1rh4AaABAg,@Guininja08,http://www.youtube.com/@Guininja08,UCCSGxPJe-wCJPP1TQyd5NIg,Obrigado por tudo,2024-03-11 11:21:28+00:00,2024-03-11T11:21:28Z,0,none,True,False,,,UCIPA6iWNaoetaa1T46RkzXw,0 days 00:00:30,30.0
MFrSq1it0Es,UgxiaJW9D-TGzWtTr7N4AaABAg,@Italogmaia881,http://www.youtube.com/@Italogmaia881,UCRl80wiUGketQCnaMDc-TdA,"Authentic,volta a fazer séries legais,com o spok,iago,baixa e o jazz,séria bem legal a família craft antiga,reunida",2024-03-11 12:32:36+00:00,2024-03-11T12:32:36Z,0,none,True,False,,,UCIPA6iWNaoetaa1T46RkzXw,0 days 01:11:08,4268.0
MFrSq1it0Es,Ugw0rhPQzzppjluMTjl4AaABAg,@E-1920SegundaGuerra,http://www.youtube.com/@E-1920SegundaGuerra,UCs-YPfnkAQfRMhyGVyuhsWQ,Authentic Imita o Minguado kkkk,2024-03-11 18:04:30+00:00,2024-03-11T18:04:30Z,0,none,True,False,,,UCIPA6iWNaoetaa1T46RkzXw,0 days 05:31:54,19914.0
MFrSq1it0Es,UgyTbPvbkvYr0btkQ9N4AaABAg,@ZMatheusZz,http://www.youtube.com/@ZMatheusZz,UCn7zsXS40_e7_Ugw0ghKlUA,Obrigado por fazer minha infância a melhor possível com seus vídeos authentic vc fez parte da minha vida seus videos sempre tiravam um sorriso de mim ❤🎉,2024-03-11 20:21:38+00:00,2024-03-11T20:21:38Z,1,none,True,False,,,UCIPA6iWNaoetaa1T46RkzXw,0 days 02:17:08,8228.0
MFrSq1it0Es,UgwgwVIg68wFl5uCtbh4AaABAg,@kaiofuinha123,http://www.youtube.com/@kaiofuinha123,UCneW_puGutoOkhFyyT2p0Sw,AuthenticGames vc sempre foi parte da minha infância até hj vc e meu yt favorito,2024-03-12 15:07:29+00:00,2024-03-12T15:07:29Z,3,none,True,False,,,UCIPA6iWNaoetaa1T46RkzXw,0 days 18:45:51,67551.0
MFrSq1it0Es,UgyhlPcBBvZI-CR51YV4AaABAg,@Viniciusgamer1213,http://www.youtube.com/@Viniciusgamer1213,UCg_J8qrYClReiepDCGXNMrw,Authentic obg por tudo vc fez minha vida feliz quando eu era pequeno que deus te abençoe❤,2024-03-12 22:08:12+00:00,2024-03-12T22:08:12Z,2,none,True,False,,,UCIPA6iWNaoetaa1T46RkzXw,0 days 07:00:43,25243.0
MFrSq1it0Es,Ugx99OZWy7CMJyblTv14AaABAg,@JoaoCarlos-qb3jw,http://www.youtube.com/@JoaoCarlos-qb3jw,UCllMD_dBmJlOIUWm5kw99mg,Authentic  cadê  jazz  vc nunca mais jogou com ele jogar uma parteda com ele de minecreft,2024-03-13 04:46:32+00:00,2024-03-13T04:46:32Z,0,none,True,False,,,UCIPA6iWNaoetaa1T46RkzXw,0 days 06:38:20,23900.0
MFrSq1it0Es,UgwbUbCrvaZ0U4igInN4AaABAg,@Ben10minegamer8,http://www.youtube.com/@Ben10minegamer8,UCxAD8d1f4lv15hxFr-ejzPQ,Vou gravar com ele,2024-03-13 13:22:25+00:00,2024-03-13T13:22:25Z,1,none,True,False,,,UCIPA6iWNaoetaa1T46RkzXw,0 days 08:35:53,30953.0
MFrSq1it0Es,UgzhdyBRPs8NOrVlM6d4AaABAg,@Ben10minegamer8,http://www.youtube.com/@Ben10minegamer8,UCxAD8d1f4lv15hxFr-ejzPQ,Voce é legal,2024-03-13 13:23:01+00:00,2024-03-13T13:23:01Z,1,none,True,False,,,UCIPA6iWNaoetaa1T46RkzXw,0 days 00:00:36,36.0
MFrSq1it0Es,Ugxl2NvnDZuLTmbVxM54AaABAg,@cesarrobertoribeiropereira6057,http://www.youtube.com/@cesarrobertoribeiropereira6057,UCBWUMF0PhgM1eE8xfv8gW_A,"Eu tenho uma ainda melhor:
Transforme seus aldeões em zumbis, os cure e depois cause uma invasão de pillagers
Ai os preços vao estar quade de graca",2024-03-13 13:27:45+00:00,2024-03-13T13:27:45Z,0,none,True,False,,,UCIPA6iWNaoetaa1T46RkzXw,0 days 00:04:44,284.0
